product_name,product_description,price,photo,brand,stock_quantity,supplier_id,category_id
me,Down I card. Unit want manage option treat. It simple base land final itself scientist.,582.12,https://placekitten.com/471/743,"Oconnor, Kelly and B",8,1,2
myself,Six truth despite debate table bag. Score west write could leg. Word save energy including.,423.41,https://placekitten.com/20/882,Nolan-Munoz,69,8,11
trial,Thousand beautiful general skin. Appear interview decade lawyer. Production rule successful she.,786.68,https://placekitten.com/496/646,Robbins Ltd,56,2,2
relationship,During product adult listen success. War person language group.,710.33,https://picsum.photos/15/960,Dyer-Sanchez,51,2,8
someone,Society big report hundred. Live simply fear maybe. Manager history particularly make.,710.95,https://placekitten.com/124/1007,Mack-Whitaker,3,3,9
try,Able growth meeting policy. Audience eight success bring dream.,289.7,https://picsum.photos/839/1015,Richmond Group,41,7,12
world,Anyone local message pressure wind huge bad. Down agree once summer whose health store.,970.71,https://dummyimage.com/647x616,Petty-Williams,16,3,13
bag,Figure sit political plan perhaps class inside official. Stock little general why.,576.04,https://placekitten.com/957/833,"Jackson, Smith and C",70,9,3
case,Interesting fill ten report popular actually.,771.76,https://picsum.photos/308/766,Olson-Cannon,70,6,10
bank,Account paper fund building population teacher prove. Purpose set mind.,806.86,https://picsum.photos/823/654,Anderson-Brown,19,3,7
wife,Back often available citizen book prevent stage. Letter trouble material tough office.,182.34,https://dummyimage.com/383x46,Daniel PLC,69,2,1
many,Understand available list nature. Leave language today success magazine cover.,773.16,https://placekitten.com/516/806,Berg-Graham,79,9,1
mention,Tough accept ability more natural wait for within. Movement work rest system black.,413.72,https://picsum.photos/750/340,Wiggins-Benitez,76,3,3
prove,Then himself she than smile tax actually. Word end south. Wish son while meeting seek could.,256.49,https://picsum.photos/662/390,Morrison Inc,23,5,2
simple,Likely part arm hospital. Eat hotel without thought hope leg.,849.9,https://placekitten.com/886/312,"Martin, Davis and Hi",62,7,1
probably,Seven town write newspaper federal matter stand. Reach act brother.,598.52,https://placekitten.com/245/270,Baker-Shaffer,41,9,3
economic,American phone than voice. Century tend lose. Wind win man rock former face.,177.38,https://dummyimage.com/996x904,Espinoza-Thornton,48,6,10
forward,"They cultural month program tonight wonder.
Different then stage force which.",913.87,https://placekitten.com/559/825,Rios and Sons,25,6,6
coach,Interesting become bank be look.,882.21,https://placekitten.com/648/102,Miller LLC,97,1,3
no,Control set song. Similar class affect personal student.,492.36,https://dummyimage.com/245x951,Turner and Sons,40,3,2
region,Option administration alone between become. Cause month game. Reflect husband common picture.,575.97,https://dummyimage.com/881x586,"Contreras, Blanchard",35,2,1
serve,Ok sure rich someone personal necessary. Democratic training want others.,715.86,https://dummyimage.com/898x71,Bean-Strickland,91,6,13
apply,Agent old whose. Individual several shake enter arm choose pass.,435.82,https://dummyimage.com/881x696,"Hernandez, Golden an",11,7,14
light,North nice contain truth we record rich officer.,943.26,https://placekitten.com/565/865,"Smith, Abbott and Ph",62,2,13
how,Perhaps clear model easy education. Particularly left sort third. Never give seem window front.,188.64,https://picsum.photos/299/984,"Riley, Brooks and So",61,4,11
knowledge,Line all decade serve. Somebody suffer indeed close claim agree main.,421.26,https://placekitten.com/890/750,Ford LLC,12,6,1
hot,So us run environment so.,592.6,https://dummyimage.com/945x529,"Jones, Williams and ",87,6,7
similar,Change treatment give. Experience trip apply tax perhaps.,616.03,https://picsum.photos/121/60,Martinez Ltd,28,7,9
movie,Offer can easy behind particular woman very.,971.46,https://picsum.photos/554/807,Ellis-Walters,2,6,7
old,Provide be must give collection close alone. Most than job theory.,449.14,https://placekitten.com/555/338,"Wilson, Santos and H",85,9,6
such,See four who former food enter. Forward finish worker arrive.,835.05,https://picsum.photos/722/137,Miles-Kennedy,50,3,6
movement,Image nice plant range. Cut peace always party much. Form order fast bank team.,524.12,https://dummyimage.com/678x192,Williams Ltd,63,6,5
age,Dream magazine create doctor many speech those test. Bring stop time weight.,785.33,https://placekitten.com/245/128,Walker-Mathis,86,7,3
particular,Could theory leader lead hospital. Whatever television future process recognize.,270.33,https://picsum.photos/871/876,"Richards, Mcneil and",62,3,4
discover,Charge trial tough suddenly while adult fine. Foreign able compare knowledge exist enjoy painting.,637.51,https://dummyimage.com/573x59,Lawson Group,27,1,5
Mr,Stuff change hit mean ask article. Quite help girl represent pressure thus machine.,966.29,https://placekitten.com/612/145,Willis-Obrien,20,1,9
language,Husband north finally because admit political. Land order response across fund.,584.08,https://picsum.photos/876/166,Ross-Edwards,36,9,14
mouth,Study sometimes season finally crime evening there. Rate dream short remain bed out.,331.88,https://placekitten.com/277/118,"Hill, George and And",71,2,12
bit,From high international exactly. Authority have year though property condition interview answer.,313.16,https://picsum.photos/538/232,Smith Group,26,9,2
rest,Computer image move this measure. Draw chair final current act phone rather above.,71.94,https://dummyimage.com/178x563,Simmons Inc,47,4,5
right,Family finish song professor. Arm figure everyone mother including. Range different join big.,771.52,https://dummyimage.com/491x208,"Campbell, May and Mo",50,9,12
all,Step fine eat fast too smile behavior. Spring notice image scientist. Not eat old court red.,213.4,https://picsum.photos/159/765,Ellison Inc,59,3,5
weight,Produce those perform you in us. Site big talk now deal.,569.12,https://placekitten.com/556/776,Johnson LLC,79,1,13
high,Style fall control smile. Out want outside blood money.,812.71,https://placekitten.com/150/30,"Williams, Potter and",26,5,6
pick,"Play about cell. Practice the remain really building.
Best season everything generation such how.",80.9,https://dummyimage.com/690x791,Scott-Contreras,60,7,11
home,Get deep production sound. Indicate arrive would scene month they modern. Result we model claim.,213.78,https://dummyimage.com/119x429,"Rojas, Miller and Wa",48,6,4
soon,Choice now agreement visit. Fact rate news other.,318.58,https://dummyimage.com/39x794,"Johnson, Jones and W",78,3,11
authority,Represent if raise its enough. News up daughter president. Woman attorney production foot mean.,912.18,https://dummyimage.com/472x842,Caldwell Ltd,14,4,14
stay,Heart interest about face. Especially better stock leave sister parent.,451.74,https://picsum.photos/244/1005,Franco Inc,48,9,7
cost,Their officer property process will. Possible where million.,747.74,https://dummyimage.com/758x920,Romero and Sons,37,1,6
network,Business culture section page buy. Then yourself thousand billion else field during hour.,963.03,https://placekitten.com/988/948,Gallegos-Lopez,16,6,8
now,Relationship staff statement poor. Seek woman market know do five too.,890.44,https://picsum.photos/997/867,Rice PLC,35,1,2
thus,Anyone approach rate growth. Theory for fish stage parent attorney.,992.54,https://picsum.photos/729/117,"Miller, Flores and R",15,5,9
trouble,Store fill me box yard a. Small clear example poor image.,270.96,https://dummyimage.com/635x692,Schneider Inc,73,6,4
key,Thank less fast at.,150.5,https://picsum.photos/846/1022,Gray-Riddle,57,9,6
culture,Tell individual until family somebody quite tend.,843.56,https://picsum.photos/512/751,Jackson Inc,28,4,2
strong,Receive our meet such. Risk shake computer experience apply.,188.38,https://dummyimage.com/815x306,"Smith, Rodriguez and",67,5,8
choose,Approach since former job around follow. Base decision draw beat.,152.61,https://dummyimage.com/49x396,Gonzalez Ltd,56,4,10
current,President end player cup argue get. Seek federal culture information tell central.,977.73,https://dummyimage.com/532x589,"Jackson, Crawford an",90,1,4
treat,Guy painting believe language very society painting. Word claim pull office about would fund.,492.89,https://picsum.photos/508/483,"Woodward, Cook and H",24,9,8
economy,Several off hundred throughout move. Foot large scene public day anyone term.,604.81,https://picsum.photos/483/185,Hernandez Ltd,89,6,9
letter,Impact particularly scene option of how. Ability seek evening skin even.,971.78,https://dummyimage.com/475x689,Stevens PLC,21,6,11
person,Community we do almost four scene benefit. Better yourself heart.,418.81,https://placekitten.com/335/997,Castro Group,46,4,11
return,Good direction every sometimes ask. Civil rather population forward. Recent democratic cell but.,793.45,https://picsum.photos/884/995,Tucker-Hale,71,5,4
could,Term garden develop range finally order how. Subject shake civil firm put she painting situation.,851.68,https://picsum.photos/559/332,"Perez, Payne and Zim",69,5,4
reality,Factor life card year. Charge side form score decision radio lay small.,913.63,https://picsum.photos/174/869,"Farmer, Caldwell and",12,3,12
these,Police main fire. Your husband treatment like follow smile officer.,580.43,https://picsum.photos/592/438,Castillo Group,77,4,11
control,Feel help decide. Measure action hour nature author role phone.,436.43,https://placekitten.com/228/132,Howell-Hoover,38,7,10
school,Machine agree stuff. Sign more detail surface. Better measure even stage.,229.72,https://dummyimage.com/481x672,"Griffith, Thompson a",99,2,6
peace,Part give often answer. Program just necessary style research former hand somebody.,709.45,https://placekitten.com/896/875,Lester LLC,70,9,14
benefit,"Per both nor add newspaper star. Some drive degree school.
Production onto kid role.",539.74,https://placekitten.com/863/66,"Villa, Graham and Mi",97,5,8
and,Sometimes yet drop. Six million purpose record southern.,942.71,https://picsum.photos/465/983,"Nelson, Hernandez an",40,5,2
before,"Yourself prove there.
Late tough discover old lawyer.",458.27,https://placekitten.com/964/82,Jimenez-Hood,59,5,4
page,Appear parent the second lot owner watch.,173.15,https://dummyimage.com/4x442,Carlson-Avery,64,4,2
keep,Country dinner plan enter she head coach. Move evening produce he.,676.61,https://placekitten.com/557/498,Sanders and Sons,60,4,9
enough,Assume light school. Exist smile author those film. High whom southern listen degree.,701.95,https://dummyimage.com/9x815,"Jones, Montgomery an",69,9,14
break,Product service movement court half follow. Development wind power too father.,453.11,https://placekitten.com/678/1010,"Randolph, Hamilton a",51,1,1
yourself,Bill no key financial media campaign. Organization suddenly tonight reason him total fund evidence.,326.14,https://dummyimage.com/788x473,Roberts-Manning,16,1,10
beat,Activity central poor station fly trial. Walk series red agent recent mouth order.,446.25,https://placekitten.com/287/596,"Turner, Nguyen and W",67,9,6
again,Across in include general become same magazine. Social think health.,384.95,https://dummyimage.com/1014x892,"Peck, Wolfe and Rice",59,8,2
loss,Reveal push clearly small only. Station message none enter magazine able Mr shake.,985.86,https://picsum.photos/547/506,Robertson-Moreno,49,8,13
east,Above star involve that early plan. Blue these agency night.,517.61,https://dummyimage.com/398x973,"Williams, Soto and E",75,8,6
act,Response wear money around. Prevent analysis month worker.,421.61,https://picsum.photos/753/954,Raymond-Lopez,54,4,12
hear,Score policy people never but. Medical occur edge college also color.,315.87,https://placekitten.com/680/175,Herrera Group,54,1,11
store,Represent her economy myself carry media someone. Feel consumer boy real student phone.,922.42,https://placekitten.com/90/647,"Montgomery, Watts an",3,3,10
whatever,Sing investment hospital analysis voice none perhaps.,186.59,https://placekitten.com/555/422,Daniel Ltd,14,5,11
future,Challenge relationship read thought address last happy. Any hospital official foreign.,936.24,https://placekitten.com/569/608,Smith Ltd,41,5,13
mean,War edge morning beat create environment dog. Three admit water us protect.,554.9,https://dummyimage.com/80x256,Ford-Atkins,23,7,11
surface,"Manage area benefit various four shoulder.
Production ok six day. At eye lose half decision.",342.2,https://placekitten.com/867/153,"Wood, Campos and Har",10,7,3
feeling,Decision speech friend foot certainly surface clearly. Middle reality spend man well.,208.39,https://dummyimage.com/573x348,Williams Inc,8,3,5
like,New trouble worker recent behavior actually. Court Congress tonight generation statement wall.,839.18,https://dummyimage.com/928x590,Lewis Inc,26,4,9
why,Can man evidence skin. Drop century wear several. Country kitchen new house painting other that.,69.69,https://dummyimage.com/957x107,"Young, Jones and Pon",44,9,14
mother,Training list soldier often. American by despite event human little item.,585.35,https://dummyimage.com/834x713,Richardson Inc,27,7,8
over,Service plan paper. Left situation other oil along individual. Role game four result citizen.,318.15,https://placekitten.com/150/475,Valdez Group,51,2,11
produce,Relationship house peace picture letter ago condition. Often piece these source.,270.36,https://dummyimage.com/614x0,"Pineda, Jones and Lo",25,8,11
father,Walk bad opportunity agree approach coach different buy. Door federal individual image.,360.62,https://picsum.photos/859/427,"Fowler, Griffin and ",98,9,9
our,Protect citizen experience involve. Wide leave make natural much against. Best least including.,899.73,https://dummyimage.com/422x87,"Murphy, Mills and St",89,7,7
across,Me recent for get too. Important positive seven party difference.,491.94,https://picsum.photos/6/719,Stevenson PLC,65,5,6
share,Final end help firm continue. Agree city determine course. Billion ahead of eye.,662.3,https://dummyimage.com/604x570,"Robinson, Taylor and",67,6,13
environmental,Save coach condition service carry. Job miss event place reveal big five.,681.1,https://picsum.photos/690/886,"Banks, Thompson and ",40,1,4
