product_name,product_description,price,photo,brand,stock_quantity,supplier_id,category_id
matter,Message standard race something. Affect article trip meeting.,648.64,https://placekitten.com/171/820,Barnett-Harrison,34,8,14
politics,Bill nearly concern receive already everybody general PM. Method happy fund.,264.23,https://dummyimage.com/317x48,"Collier, Fowler and Perez",42,5,9
new,Though inside drop itself woman nice person. Set individual open too smile.,359.79,https://placekitten.com/662/168,Thomas-Davis,39,6,10
forget,Service process various hand. Decide performance magazine.,411.31,https://dummyimage.com/796x511,Floyd-Williams,42,2,12
sport,Mrs seven house pull professional win. Now fine seven admit simple time plan.,244.37,https://picsum.photos/657/303,Davidson-Cameron,33,5,3
politics,Strategy deep they agency final. Special crime culture.,307.68,https://dummyimage.com/996x600,Walters-Price,16,4,8
join,Usually all rather. Past whole whether section wear agreement direction.,200.4,https://dummyimage.com/252x988,"Peterson, Sullivan and Stewart",53,3,10
phone,Commercial just executive subject do. Ever business deep consumer sea.,607.93,https://placekitten.com/50/152,Myers-Coffey,9,6,5
weight,Certainly direction team travel use. Star size call debate such board dream.,704.75,https://dummyimage.com/118x892,Ritter Group,33,5,1
her,"Practice guy expert bank but.
Wish cell owner care.",524.3,https://dummyimage.com/42x727,Davis-Burns,61,4,13
join,Base reduce rich personal. Analysis line system scientist. City because voice participant.,359.59,https://placekitten.com/257/409,Tate-Hawkins,92,10,5
remember,Across safe cell. Next become prepare remember style.,466.9,https://picsum.photos/623/733,"Richards, Gonzales and Robles",92,4,13
big,He evidence gun board foreign discover. Those either should local about be. Citizen just material.,824.96,https://dummyimage.com/277x135,Miller LLC,77,7,11
I,"Left green finally gas blue interest.
Arrive care up responsibility work. School dinner board.",204.01,https://picsum.photos/721/978,Sims Ltd,98,9,3
modern,Work put world art throw white sing.,991.88,https://placekitten.com/875/457,"Jenkins, Kim and Thompson",7,6,10
rest,Help could hot floor board. Debate major lawyer sing. Shake phone music before off.,330.84,https://dummyimage.com/177x76,Robertson Ltd,9,2,13
eye,Chance act which three land. Particularly analysis get plant act everyone song tree.,852.41,https://picsum.photos/292/857,Christian-Rodriguez,66,6,1
partner,Join need center early while. To respond community quite system.,678.12,https://placekitten.com/244/624,Montoya Group,65,5,7
seven,Scene size medical it cause few operation meet. Beautiful different next.,112.47,https://picsum.photos/786/461,Daniel Group,79,2,12
first,Raise short age wrong above. Guess could action reason today and. West single indeed.,278.2,https://dummyimage.com/266x24,"Lewis, Green and Evans",88,7,2
box,Protect move fast born ground better statement.,627.39,https://picsum.photos/162/1012,"Miller, Cooper and Houston",63,2,12
student,Me several able necessary.,481.22,https://picsum.photos/225/477,Reyes-Brown,11,4,3
food,Appear require small also technology boy. Word local nor turn me son summer.,60.16,https://picsum.photos/555/805,Duncan Ltd,78,1,4
magazine,On young recent fish population body board speak. Person no go student middle.,872.79,https://placekitten.com/855/368,"Blanchard, Jackson and Price",59,6,14
indeed,Century fire near case play hear feel. Score knowledge employee meeting possible set.,688.23,https://placekitten.com/626/574,Griffin Inc,89,1,3
glass,Possible crime sister suddenly card. Time sense position red.,799.21,https://dummyimage.com/143x359,Ortiz-Scott,2,8,15
college,Determine kitchen series. Because perform PM nation travel.,395.6,https://placekitten.com/219/334,Rodgers Group,60,7,11
table,Almost subject toward resource. End if town moment tend. Study newspaper compare ok national.,323.25,https://picsum.photos/319/801,Jones and Sons,70,8,7
statement,Relate decide notice talk expert street. Feel child opportunity foreign. Culture morning speech.,877.88,https://picsum.photos/414/515,Ward-Henderson,92,2,14
never,Debate statement truth. Main follow media environmental.,274.24,https://picsum.photos/771/224,Walker-Hernandez,39,8,6
industry,Little staff nature employee six near though organization. Poor industry class.,972.38,https://picsum.photos/757/194,"Green, Decker and Morales",65,3,12
building,Generation magazine part address science be western. Defense matter clear while job available.,56.63,https://placekitten.com/366/852,Wright Inc,80,1,11
project,Attorney film interview page last energy. Week free century.,318.95,https://dummyimage.com/733x41,"Mcdonald, Morgan and Andrade",14,2,9
western,Their live lot information week safe. Specific environmental quickly out program.,376.33,https://placekitten.com/953/796,"Robinson, Hunt and Armstrong",86,3,5
source,Worker bill herself. Major add expert wonder.,520.1,https://picsum.photos/214/975,"Wilson, Sharp and Clark",18,5,15
total,Model happen gas training protect manager include. Here evidence claim nearly.,901.2,https://picsum.photos/627/3,Steele-Frost,60,1,11
speech,Point strong event others. Opportunity those nearly home site our. Right employee audience feel.,467.59,https://placekitten.com/993/804,Johnson LLC,75,2,13
seven,Series he place though least. Maybe church meet anything price.,56.27,https://placekitten.com/518/159,Holt-Peterson,65,4,8
figure,Condition agency company clear. Daughter home book include assume crime.,313.21,https://placekitten.com/617/223,"Alexander, Barajas and Rodriguez",89,3,5
top,Energy could single might. Share forget carry. Certainly husband certainly.,285.37,https://picsum.photos/463/507,"Lewis, West and Reyes",25,3,12
foreign,Front police floor against group. Show unit various Mr early friend thousand.,945.56,https://dummyimage.com/315x435,Bailey-Cook,83,7,7
general,Threat above international still yard focus. Still do plan.,347.49,https://placekitten.com/418/587,"Harris, Cole and Smith",88,10,3
raise,Role not window meet then leader argue. Seek subject institution close less other if.,883.74,https://picsum.photos/218/502,"Juarez, Orr and Krueger",44,2,15
beat,Stand expert involve concern.,146.32,https://picsum.photos/854/636,Brown Group,56,2,10
mouth,Professor focus cold.,599.53,https://placekitten.com/342/165,"Thomas, Wright and Stevenson",61,3,13
environmental,Strategy significant range against.,789.25,https://picsum.photos/9/194,"Thompson, Aguirre and Fuller",26,4,7
statement,Leg theory police hand. Pay agent include. Down per since possible break.,54.86,https://picsum.photos/891/21,Mcdonald Inc,11,8,4
increase,Fact Democrat science. Well wear send. Decision five last example expect nothing blood bit.,726.68,https://placekitten.com/870/203,Hoffman-Melton,35,1,7
actually,Your successful your product yes. Compare resource unit.,301.04,https://picsum.photos/11/86,Miller Ltd,53,5,1
these,Early report economy relationship health its each. Rest task rock. Someone people brother.,286.35,https://dummyimage.com/628x100,Bentley-Ayers,81,4,10
hour,Field return western politics idea. Wind fight enough make.,787.81,https://picsum.photos/418/871,Lawson-Harris,75,1,14
green,Cut live reason prove. Guy character thousand seat easy.,506.11,https://placekitten.com/667/208,Adams-Silva,96,2,12
very,Least carry protect market easy fast run else. Wait face parent improve special carry whose.,287.25,https://placekitten.com/487/367,Parsons-Norton,20,10,10
office,Value give simple some. Discussion find rock board less travel consumer. Letter majority name.,603.81,https://placekitten.com/506/371,Jenkins Ltd,38,4,13
themselves,Everything raise trip beautiful magazine public analysis. Write cover color.,785.69,https://placekitten.com/635/861,Clark-Chen,1,8,9
relate,Century gas create onto education. Weight worker all case card could pick.,328.34,https://placekitten.com/684/211,Fields-Swanson,58,9,15
they,Purpose thus treat. Friend work himself change well.,826.18,https://picsum.photos/478/800,Henry-Avila,60,3,11
great,Something name natural state growth. Parent family social sort though.,514.43,https://picsum.photos/159/483,Brown-Richardson,89,2,15
discussion,Say task join. Little couple well teach subject.,350.7,https://dummyimage.com/989x813,"Barton, Mckee and Hill",88,8,11
write,Not free send spend top sense. Born here civil really true.,103.31,https://picsum.photos/335/799,"Sherman, Hall and Holt",61,9,2
child,Model everyone ago many.,97.78,https://placekitten.com/584/700,Bradshaw-Guzman,57,9,6
road,Visit add poor. Way much eight money. Claim unit recognize test provide.,488.55,https://picsum.photos/211/303,"Rose, Deleon and Cross",32,5,7
medical,Race sit student daughter campaign long detail high. Pattern crime risk toward.,905.38,https://dummyimage.com/817x586,"Chavez, Mclean and Gordon",72,5,13
successful,Of go policy star series any. Mean city run area goal whole player. Organization yeah shake while.,310.18,https://picsum.photos/634/615,Kidd Ltd,4,8,5
table,Common film practice spend identify.,840.97,https://picsum.photos/199/270,"Alexander, Acosta and Wells",68,4,15
contain,Affect smile power could same summer include. Ground positive significant possible most available.,623.47,https://picsum.photos/881/170,Jones Inc,64,5,14
very,Inside become any reach real. Pick maintain build party traditional official small.,593.11,https://picsum.photos/388/644,Ramirez Group,36,7,9
head,Create large eat red near. Everything although adult friend share finish least.,243.43,https://placekitten.com/293/58,Mccormick-Clark,46,2,14
treatment,Usually success investment large person early. Choice civil candidate.,881.15,https://placekitten.com/895/893,Lang Group,91,4,13
station,Foreign move hit employee agent. Least key alone group notice.,56.2,https://picsum.photos/897/402,Palmer-Wilson,29,1,15
with,Born happy treatment answer choose. Order base it number result TV spring authority.,606.98,https://placekitten.com/53/549,Adams-Brewer,77,4,6
card,"Would far professor. Everything simple policy home.
Increase happy can first teach reach.",161.2,https://dummyimage.com/743x645,Hernandez Ltd,62,9,15
without,Mission add difficult wonder nice. Then sure nature amount. Fire former sister dream study paper.,576.4,https://dummyimage.com/421x525,Frost and Sons,37,3,14
beautiful,They two behind economic important from. Mention often sure reduce president.,610.36,https://dummyimage.com/401x1015,Jones-Osborne,100,10,8
space,Agree who result group social situation school.,207.04,https://picsum.photos/398/174,Hunt-White,68,4,11
program,Imagine everybody thought. People rule picture upon you try.,721.44,https://picsum.photos/875/234,Gordon Inc,88,10,14
fish,Word walk coach pull amount smile.,552.37,https://picsum.photos/896/309,Ward Group,69,9,1
something,Its food glass. Big improve someone find across able. Out hope raise focus.,672.19,https://dummyimage.com/39x67,"Goodman, Moreno and Wolf",32,7,15
significant,Include house peace suggest. Charge phone ask particularly just. Last walk seat you difficult task.,98.65,https://dummyimage.com/905x744,"Figueroa, Moreno and Hinton",54,9,12
direction,Tonight style worry church soon daughter.,908.68,https://dummyimage.com/101x624,Bell and Sons,9,4,10
attack,General onto seek skin. Buy tell call floor door language. Maybe cause management deal science.,954.67,https://picsum.photos/1007/848,"Dawson, Mendoza and Stanton",94,4,3
half,Class loss set recent option late group.,636.96,https://picsum.photos/396/728,Hernandez-Hicks,97,8,8
which,Weight everybody somebody successful rest never TV. Hand foreign red close.,400.05,https://placekitten.com/62/354,Douglas-Beck,41,1,6
court,Soldier meeting standard most more see. Only reduce owner.,996.22,https://placekitten.com/685/305,Dixon and Sons,11,5,2
seek,Interesting movement vote pressure within. Them white impact minute speech.,723.45,https://placekitten.com/417/210,Braun Group,72,1,10
money,Scene fill group theory off fire ready. Term they my care ten go significant.,760.49,https://placekitten.com/468/435,Schultz-Ferguson,28,1,15
it,Onto real since fine win control. Kitchen probably mean surface station sea likely onto.,127.27,https://picsum.photos/117/940,"Howard, Williamson and Paul",45,8,4
spend,"Cost option also join defense.
To sell hot nothing serious.",716.55,https://picsum.photos/549/893,"Schneider, Fuentes and Garcia",49,2,9
total,Outside quite always girl perhaps. Ability religious might for executive meeting.,859.61,https://placekitten.com/958/766,Perkins-Jones,65,3,2
before,Think why whom find way dark. Dream cell protect maybe. Chair pull might stage live seat receive.,554.03,https://placekitten.com/658/229,Maldonado-Ramirez,70,1,1
might,Half ground bill station his. Magazine recognize something law boy news.,589.69,https://dummyimage.com/734x453,Coleman and Sons,16,3,14
Republican,Another measure my risk us. Yet reality imagine role couple. Tough former research meet.,401.09,https://dummyimage.com/551x460,"Howell, Brooks and Moran",19,9,3
agree,Lose push far reflect pay out nature. Cup common ago power everything economy.,271.3,https://dummyimage.com/553x4,"Brown, Allen and Rice",12,2,6
born,Two number Mr. Third exactly only again military test.,814.9,https://placekitten.com/881/865,Freeman Group,32,9,13
whole,Month building remain ball father. Degree debate purpose way near.,512.13,https://dummyimage.com/754x309,Nelson-Curtis,34,4,4
he,Air type job grow south. Avoid one reduce hundred wish one exist. Wind customer instead.,811.2,https://picsum.photos/701/352,Hess Inc,36,3,6
ground,Number service current talk. Account student leader miss movement whose close miss.,597.61,https://picsum.photos/573/440,Rasmussen and Sons,12,9,1
find,Later husband despite sound democratic perform bad. Bit run now spring top offer eight.,482.79,https://picsum.photos/294/90,"Davis, Henderson and Kirby",38,8,6
strong,Painting campaign air own. Provide near everyone skill. She message chair find recognize increase.,944.13,https://placekitten.com/305/828,"Fuller, Cook and Green",69,4,12
thus,Explain law continue five. Stage future school catch read six news.,686.13,https://dummyimage.com/486x480,Torres-Chapman,24,2,8
